{
  "contract_version": "4.0.0",
  "as_of": "2026-03-06T16:00:00.000000Z",
  "valid_at": "2024-02-01T00:00:00.000000Z",
  "system_as_of": "2026-04-01T00:00:00.000000Z",
  "hash_algorithm": "sha256:financeiq-pit-snapshot-v4",
  "dimension_key": [
    "entity_id",
    "security_id",
    "field",
    "period_type",
    "period_basis",
    "currency",
    "unit",
    "scale",
    "consolidation",
    "accounting_basis"
  ],
  "content_hash": "96aae6defad9399df75a1dd20dd6aefbc8ebd8f0d7e2ca3da05769d3fd7ccf5c",
  "facts": [
    {
      "schema_version": "4.0.0",
      "security_id": "NOT_APPLICABLE",
      "field": "invented_sales",
      "currency": "TRY",
      "unit": "MONETARY",
      "scale": "THOUSAND",
      "consolidation": "CONSOLIDATED",
      "accounting_basis": "TFRS_HISTORICAL",
      "measuring_unit_date": null,
      "value_type": "DECIMAL_STRING",
      "period_basis": "CUMULATIVE",
      "extraction_method": "SYNTHETIC",
      "extraction_version": "synthetic-v1",
      "review_status": "REVIEWED",
      "fact_version_id": "SYN-P24-FY",
      "entity_id": "SYN-ENTITY-1",
      "period_type": "FY",
      "value": "4500.125",
      "valid_from": "2023-12-31T21:00:00Z",
      "valid_to": "2024-12-31T21:00:00Z",
      "known_at_lower": "2025-03-07T16:00:00Z",
      "known_at_upper": "2025-03-07T16:00:00Z",
      "known_at_precision": "EXACT_TIMESTAMP",
      "source_doc_id": "SYN-DOC-104",
      "source_hash": "0404040404040404040404040404040404040404040404040404040404040404",
      "source_locator": "invented-2024-annual-report:income-statement:row-1",
      "recorded_at": "2025-03-08T00:00:00Z",
      "notes": "Synthetic 12M cumulative amount as published.",
      "publication_timezone": null
    },
    {
      "schema_version": "4.0.0",
      "security_id": "NOT_APPLICABLE",
      "field": "invented_sales",
      "currency": "TRY",
      "unit": "MONETARY",
      "scale": "THOUSAND",
      "consolidation": "CONSOLIDATED",
      "accounting_basis": "IAS29_RESTATED",
      "measuring_unit_date": "2025-12-31",
      "value_type": "DECIMAL_STRING",
      "period_basis": "CUMULATIVE",
      "extraction_method": "SYNTHETIC",
      "extraction_version": "synthetic-v1",
      "review_status": "REVIEWED",
      "fact_version_id": "SYN-P24-FY-IAS29",
      "entity_id": "SYN-ENTITY-1",
      "period_type": "FY",
      "value": "5100.5",
      "valid_from": "2023-12-31T21:00:00Z",
      "valid_to": "2024-12-31T21:00:00Z",
      "known_at_lower": "2026-03-06T16:00:00Z",
      "known_at_upper": "2026-03-06T16:00:00Z",
      "known_at_precision": "EXACT_TIMESTAMP",
      "source_doc_id": "SYN-DOC-105",
      "source_hash": "0505050505050505050505050505050505050505050505050505050505050505",
      "source_locator": "invented-2025-annual-report:comparative-column:row-1",
      "recorded_at": "2026-03-07T00:00:00Z",
      "notes": "Synthetic FY2024 12M comparative republished in the FY2025 report in the measuring unit current at 2025-12-31.",
      "publication_timezone": null
    },
    {
      "schema_version": "4.0.0",
      "security_id": "NOT_APPLICABLE",
      "field": "invented_sales",
      "currency": "TRY",
      "unit": "MONETARY",
      "scale": "THOUSAND",
      "consolidation": "CONSOLIDATED",
      "accounting_basis": "TFRS_HISTORICAL",
      "measuring_unit_date": null,
      "value_type": "DECIMAL_STRING",
      "period_basis": "CUMULATIVE",
      "extraction_method": "SYNTHETIC",
      "extraction_version": "synthetic-v1",
      "review_status": "REVIEWED",
      "fact_version_id": "SYN-P24-H1",
      "entity_id": "SYN-ENTITY-1",
      "period_type": "H1",
      "value": "2600.25",
      "valid_from": "2023-12-31T21:00:00Z",
      "valid_to": "2024-06-30T21:00:00Z",
      "known_at_lower": "2024-08-09T15:30:00Z",
      "known_at_upper": "2024-08-09T15:30:00Z",
      "known_at_precision": "EXACT_TIMESTAMP",
      "source_doc_id": "SYN-DOC-102",
      "source_hash": "0202020202020202020202020202020202020202020202020202020202020202",
      "source_locator": "invented-2024-6m-report:income-statement:row-1",
      "recorded_at": "2024-08-10T00:00:00Z",
      "notes": "Synthetic 6M cumulative amount as published.",
      "publication_timezone": null
    },
    {
      "schema_version": "4.0.0",
      "security_id": "NOT_APPLICABLE",
      "field": "invented_sales",
      "currency": "TRY",
      "unit": "MONETARY",
      "scale": "THOUSAND",
      "consolidation": "CONSOLIDATED",
      "accounting_basis": "TFRS_HISTORICAL",
      "measuring_unit_date": null,
      "value_type": "DECIMAL_STRING",
      "period_basis": "CUMULATIVE",
      "extraction_method": "SYNTHETIC",
      "extraction_version": "synthetic-v1",
      "review_status": "REVIEWED",
      "fact_version_id": "SYN-P24-M9",
      "entity_id": "SYN-ENTITY-1",
      "period_type": "M9",
      "value": "3700.0",
      "valid_from": "2023-12-31T21:00:00Z",
      "valid_to": "2024-09-30T21:00:00Z",
      "known_at_lower": "2024-11-07T21:00:00Z",
      "known_at_upper": "2024-11-08T21:00:00Z",
      "known_at_precision": "DATE_ONLY",
      "publication_timezone": "Europe/Istanbul",
      "source_doc_id": "SYN-DOC-103",
      "source_hash": "0303030303030303030303030303030303030303030303030303030303030303",
      "source_locator": "invented-2024-9m-report:income-statement:row-1",
      "recorded_at": "2024-11-12T00:00:00Z",
      "notes": "Synthetic 9M cumulative amount as published; date-only publication."
    },
    {
      "schema_version": "4.0.0",
      "security_id": "NOT_APPLICABLE",
      "field": "invented_sales",
      "currency": "TRY",
      "unit": "MONETARY",
      "scale": "THOUSAND",
      "consolidation": "CONSOLIDATED",
      "accounting_basis": "TFRS_HISTORICAL",
      "measuring_unit_date": null,
      "value_type": "DECIMAL_STRING",
      "period_basis": "CUMULATIVE",
      "extraction_method": "SYNTHETIC",
      "extraction_version": "synthetic-v1",
      "review_status": "REVIEWED",
      "fact_version_id": "SYN-P24-Q1",
      "entity_id": "SYN-ENTITY-1",
      "period_type": "Q1",
      "value": "1200.5",
      "valid_from": "2023-12-31T21:00:00Z",
      "valid_to": "2024-03-31T21:00:00Z",
      "known_at_lower": "2024-05-10T15:00:00Z",
      "known_at_upper": "2024-05-10T15:00:00Z",
      "known_at_precision": "EXACT_TIMESTAMP",
      "source_doc_id": "SYN-DOC-101",
      "source_hash": "0101010101010101010101010101010101010101010101010101010101010101",
      "source_locator": "invented-2024-3m-report:income-statement:row-1",
      "recorded_at": "2024-05-11T00:00:00Z",
      "notes": "Synthetic 3M cumulative amount as published.",
      "publication_timezone": null
    }
  ]
}
