{"as_of":"2026-03-06T16:00:00.000000Z","content_hash":"96aae6defad9399df75a1dd20dd6aefbc8ebd8f0d7e2ca3da05769d3fd7ccf5c","contract_version":"4.0.0","dimension_key":["entity_id","security_id","field","period_type","period_basis","currency","unit","scale","consolidation","accounting_basis"],"facts":[{"accounting_basis":"TFRS_HISTORICAL","consolidation":"CONSOLIDATED","currency":"TRY","entity_id":"SYN-ENTITY-1","extraction_method":"SYNTHETIC","extraction_version":"synthetic-v1","fact_version_id":"SYN-P24-FY","field":"invented_sales","known_at_lower":"2025-03-07T16:00:00Z","known_at_precision":"EXACT_TIMESTAMP","known_at_upper":"2025-03-07T16:00:00Z","measuring_unit_date":null,"notes":"Synthetic 12M cumulative amount as published.","period_basis":"CUMULATIVE","period_type":"FY","publication_timezone":null,"recorded_at":"2025-03-08T00:00:00Z","review_status":"REVIEWED","scale":"THOUSAND","schema_version":"4.0.0","security_id":"NOT_APPLICABLE","source_doc_id":"SYN-DOC-104","source_hash":"0404040404040404040404040404040404040404040404040404040404040404","source_locator":"invented-2024-annual-report:income-statement:row-1","unit":"MONETARY","valid_from":"2023-12-31T21:00:00Z","valid_to":"2024-12-31T21:00:00Z","value":"4500.125","value_type":"DECIMAL_STRING"},{"accounting_basis":"IAS29_RESTATED","consolidation":"CONSOLIDATED","currency":"TRY","entity_id":"SYN-ENTITY-1","extraction_method":"SYNTHETIC","extraction_version":"synthetic-v1","fact_version_id":"SYN-P24-FY-IAS29","field":"invented_sales","known_at_lower":"2026-03-06T16:00:00Z","known_at_precision":"EXACT_TIMESTAMP","known_at_upper":"2026-03-06T16:00:00Z","measuring_unit_date":"2025-12-31","notes":"Synthetic FY2024 12M comparative republished in the FY2025 report in the measuring unit current at 2025-12-31.","period_basis":"CUMULATIVE","period_type":"FY","publication_timezone":null,"recorded_at":"2026-03-07T00:00:00Z","review_status":"REVIEWED","scale":"THOUSAND","schema_version":"4.0.0","security_id":"NOT_APPLICABLE","source_doc_id":"SYN-DOC-105","source_hash":"0505050505050505050505050505050505050505050505050505050505050505","source_locator":"invented-2025-annual-report:comparative-column:row-1","unit":"MONETARY","valid_from":"2023-12-31T21:00:00Z","valid_to":"2024-12-31T21:00:00Z","value":"5100.5","value_type":"DECIMAL_STRING"},{"accounting_basis":"TFRS_HISTORICAL","consolidation":"CONSOLIDATED","currency":"TRY","entity_id":"SYN-ENTITY-1","extraction_method":"SYNTHETIC","extraction_version":"synthetic-v1","fact_version_id":"SYN-P24-H1","field":"invented_sales","known_at_lower":"2024-08-09T15:30:00Z","known_at_precision":"EXACT_TIMESTAMP","known_at_upper":"2024-08-09T15:30:00Z","measuring_unit_date":null,"notes":"Synthetic 6M cumulative amount as published.","period_basis":"CUMULATIVE","period_type":"H1","publication_timezone":null,"recorded_at":"2024-08-10T00:00:00Z","review_status":"REVIEWED","scale":"THOUSAND","schema_version":"4.0.0","security_id":"NOT_APPLICABLE","source_doc_id":"SYN-DOC-102","source_hash":"0202020202020202020202020202020202020202020202020202020202020202","source_locator":"invented-2024-6m-report:income-statement:row-1","unit":"MONETARY","valid_from":"2023-12-31T21:00:00Z","valid_to":"2024-06-30T21:00:00Z","value":"2600.25","value_type":"DECIMAL_STRING"},{"accounting_basis":"TFRS_HISTORICAL","consolidation":"CONSOLIDATED","currency":"TRY","entity_id":"SYN-ENTITY-1","extraction_method":"SYNTHETIC","extraction_version":"synthetic-v1","fact_version_id":"SYN-P24-M9","field":"invented_sales","known_at_lower":"2024-11-07T21:00:00Z","known_at_precision":"DATE_ONLY","known_at_upper":"2024-11-08T21:00:00Z","measuring_unit_date":null,"notes":"Synthetic 9M cumulative amount as published; date-only publication.","period_basis":"CUMULATIVE","period_type":"M9","publication_timezone":"Europe/Istanbul","recorded_at":"2024-11-12T00:00:00Z","review_status":"REVIEWED","scale":"THOUSAND","schema_version":"4.0.0","security_id":"NOT_APPLICABLE","source_doc_id":"SYN-DOC-103","source_hash":"0303030303030303030303030303030303030303030303030303030303030303","source_locator":"invented-2024-9m-report:income-statement:row-1","unit":"MONETARY","valid_from":"2023-12-31T21:00:00Z","valid_to":"2024-09-30T21:00:00Z","value":"3700.0","value_type":"DECIMAL_STRING"},{"accounting_basis":"TFRS_HISTORICAL","consolidation":"CONSOLIDATED","currency":"TRY","entity_id":"SYN-ENTITY-1","extraction_method":"SYNTHETIC","extraction_version":"synthetic-v1","fact_version_id":"SYN-P24-Q1","field":"invented_sales","known_at_lower":"2024-05-10T15:00:00Z","known_at_precision":"EXACT_TIMESTAMP","known_at_upper":"2024-05-10T15:00:00Z","measuring_unit_date":null,"notes":"Synthetic 3M cumulative amount as published.","period_basis":"CUMULATIVE","period_type":"Q1","publication_timezone":null,"recorded_at":"2024-05-11T00:00:00Z","review_status":"REVIEWED","scale":"THOUSAND","schema_version":"4.0.0","security_id":"NOT_APPLICABLE","source_doc_id":"SYN-DOC-101","source_hash":"0101010101010101010101010101010101010101010101010101010101010101","source_locator":"invented-2024-3m-report:income-statement:row-1","unit":"MONETARY","valid_from":"2023-12-31T21:00:00Z","valid_to":"2024-03-31T21:00:00Z","value":"1200.5","value_type":"DECIMAL_STRING"}],"hash_algorithm":"sha256:financeiq-pit-snapshot-v4","system_as_of":"2026-04-01T00:00:00.000000Z","valid_at":"2024-02-01T00:00:00.000000Z"}